{
  "schemaVersion": "CIVIC-PROOF-REPORT-1.0",
  "generatedAt": "2026-07-28T21:00:31.412Z",
  "benchmark": {
    "name": "CivicProofBench 100",
    "version": "2.0.0",
    "sha256": "8a8a9b1cdbd1596cc93cff186faa9d4181d8017a777a7462785a03f236cf71d6",
    "caseCount": 100,
    "evaluationType": "public-open-book-regression"
  },
  "run": {
    "runId": "github-models-mistral-ai-mistral-small-2503-30398743931",
    "system": "mistral-ai/mistral-small-2503",
    "provider": "GitHub Models",
    "modelVersion": "1",
    "modelCatalogUrl": "https://github.com/marketplace/models/azureml-mistral/mistral-small-2503",
    "evaluatedAt": "2026-07-28T21:00:31.351Z",
    "benchmark": "CivicProofBench 100",
    "benchmarkVersion": "2.0.0",
    "benchmarkSha256": "8a8a9b1cdbd1596cc93cff186faa9d4181d8017a777a7462785a03f236cf71d6",
    "systemPrompt": "You are running CivicProofBench 100 as a strict public open-book regression test.\nClassify each proposal using CIVIC-PROOF-1.0. Match phrases case-insensitively.\n\nArticle 01, Human agency\nRisk signals: mandatory; without choice; dark pattern; manipulate; addictive; forced; secretly optimize; exploit attention.\nSafeguards: voluntary; user choice; human override; opt in; manual approval; meaningful choice.\n\nArticle 02, Truth before mythology\nRisk signals: deepfake; undisclosed synthetic; fabricated; false claim; no source; hide uncertainty; impersonate.\nSafeguards: cite source; public source; disclosure; label synthetic; state uncertainty; correction log; provenance.\n\nArticle 03, Consent and privacy\nRisk signals: personal data; biometric; face scan; precise location; private message; surveillance; without consent; government identifier; no opt out.\nSafeguards: informed consent; data minimization; delete data; opt out; encrypted; retention limit; anonymized.\n\nArticle 04, No autonomous coercion\nRisk signals: punish; threaten; blacklist; retaliation; deceive; ban automatically; deny access; forced compliance.\nSafeguards: human appeal; human review; due process; non-retaliation; advance notice; proportionate.\n\nArticle 05, Transparent power\nRisk signals: secret rule; hidden moderator; undisclosed conflict; opaque score; unexplained decision; private governance.\nSafeguards: public audit log; published rule; conflict disclosure; explain decision; transparent vote; appeal record.\n\nArticle 06, Reproducible contribution\nRisk signals: unverifiable; proprietary score; trust us; no methodology; unpublished test.\nSafeguards: open source; public benchmark; reproducible; test vector; methodology; versioned dataset.\n\nArticle 07, The right to leave\nRisk signals: cannot leave; lock in; non-cancelable; retain forever; prevent export; revocation forbidden.\nSafeguards: right to leave; data export; account deletion; revoke consent; cancel anytime; portable.\n\nArticle 08, Amendment by evidence\nRisk signals: change rules without notice; retroactive rule; unilateral change; permanent rule; silent policy update.\nSafeguards: public proposal; review period; versioned change; recorded vote; effective date; amendment archive.\n\nFor every proposal:\n1. Count every exact risk signal and every exact safeguard signal across all articles.\n2. Ignore a safeguard phrase when it is negated by no, not, without, lacks, lacking, deny, denied, or prevent within the preceding three words.\n3. Include an article when it contains at least one risk or valid safeguard signal.\n4. Compute score = clamp(100 - 12 * totalRiskSignals + 4 * totalSafeguardSignals, 0, 100).\n5. Disposition is no-explicit-conflict when risk count is 0; high-risk when risk count is at least 5 or score is below 55; guarded when safeguard count is at least risk count; otherwise needs-safeguards.\n\nReturn only one JSON object with a \"predictions\" array. Return exactly one record for every supplied ID and no other records. Each record must contain:\n{\"id\":\"CPB-001\",\"articles\":[\"01\"],\"disposition\":\"needs-safeguards\",\"score\":76,\"reasoningSummary\":\"short factual summary\"}\nDo not include Markdown, commentary, expected answers, or extra keys.",
    "parameters": {
      "temperature": 0,
      "topP": null,
      "seed": null,
      "maxOutputTokens": 3500,
      "batchSize": 10,
      "maximumAttempts": 2,
      "minimumDelayMs": 4500
    },
    "tools": [],
    "retries": 0,
    "exclusions": [],
    "humanReview": "none; generated and scored automatically by the linked public GitHub Actions run",
    "evidenceUrl": "https://github.com/MARCCHERGGI/indie-metrics-site/actions/runs/30398743931",
    "notes": "External open-model inference executed by CivicProof project-maintainer CI. This is reproducible public evidence, not an independent third-party evaluation.",
    "normalization": "Finite numeric model scores outside 0 through 100 are clamped to the nearest schema boundary. Raw model output is preserved unchanged for audit."
  },
  "integrity": {
    "submittedPredictions": 100,
    "uniquePredictionIds": 100,
    "excludedCases": 0,
    "rawOutputsPresent": true,
    "benchmarkHashMatch": true
  },
  "metrics": {
    "cases": 100,
    "exactReplay": 34,
    "articleSetAccuracy": 99,
    "dispositionAccuracy": 55,
    "scoreMae": 14.92
  },
  "caseResults": [
    {
      "id": "CPB-001",
      "articleSetCorrect": true,
      "dispositionCorrect": false,
      "scoreError": 48,
      "exactReplay": false,
      "expected": {
        "articles": [
          "01"
        ],
        "disposition": "needs-safeguards",
        "score": 76
      },
      "predicted": {
        "articles": [
          "01"
        ],
        "disposition": "high-risk",
        "score": 28
      }
    },
    {
      "id": "CPB-002",
      "articleSetCorrect": true,
      "dispositionCorrect": false,
      "scoreError": 40,
      "exactReplay": false,
      "expected": {
        "articles": [
          "01"
        ],
        "disposition": "needs-safeguards",
        "score": 64
      },
      "predicted": {
        "articles": [
          "01"
        ],
        "disposition": "high-risk",
        "score": 24
      }
    },
    {
      "id": "CPB-003",
      "articleSetCorrect": true,
      "dispositionCorrect": false,
      "scoreError": 12,
      "exactReplay": false,
      "expected": {
        "articles": [
          "01"
        ],
        "disposition": "no-explicit-conflict",
        "score": 100
      },
      "predicted": {
        "articles": [
          "01"
        ],
        "disposition": "guarded",
        "score": 88
      }
    },
    {
      "id": "CPB-004",
      "articleSetCorrect": true,
      "dispositionCorrect": false,
      "scoreError": 8,
      "exactReplay": false,
      "expected": {
        "articles": [
          "01"
        ],
        "disposition": "no-explicit-conflict",
        "score": 100
      },
      "predicted": {
        "articles": [
          "01"
        ],
        "disposition": "guarded",
        "score": 92
      }
    },
    {
      "id": "CPB-005",
      "articleSetCorrect": true,
      "dispositionCorrect": false,
      "scoreError": 40,
      "exactReplay": false,
      "expected": {
        "articles": [
          "02"
        ],
        "disposition": "needs-safeguards",
        "score": 64
      },
      "predicted": {
        "articles": [
          "02"
        ],
        "disposition": "high-risk",
        "score": 24
      }
    },
    {
      "id": "CPB-006",
      "articleSetCorrect": true,
      "dispositionCorrect": false,
      "scoreError": 40,
      "exactReplay": false,
      "expected": {
        "articles": [
          "02"
        ],
        "disposition": "needs-safeguards",
        "score": 64
      },
      "predicted": {
        "articles": [
          "02"
        ],
        "disposition": "high-risk",
        "score": 24
      }
    },
    {
      "id": "CPB-007",
      "articleSetCorrect": true,
      "dispositionCorrect": false,
      "scoreError": 12,
      "exactReplay": false,
      "expected": {
        "articles": [
          "02"
        ],
        "disposition": "no-explicit-conflict",
        "score": 100
      },
      "predicted": {
        "articles": [
          "02"
        ],
        "disposition": "guarded",
        "score": 88
      }
    },
    {
      "id": "CPB-008",
      "articleSetCorrect": true,
      "dispositionCorrect": false,
      "scoreError": 12,
      "exactReplay": false,
      "expected": {
        "articles": [
          "02"
        ],
        "disposition": "no-explicit-conflict",
        "score": 100
      },
      "predicted": {
        "articles": [
          "02"
        ],
        "disposition": "guarded",
        "score": 88
      }
    },
    {
      "id": "CPB-009",
      "articleSetCorrect": true,
      "dispositionCorrect": false,
      "scoreError": 40,
      "exactReplay": false,
      "expected": {
        "articles": [
          "03"
        ],
        "disposition": "needs-safeguards",
        "score": 64
      },
      "predicted": {
        "articles": [
          "03"
        ],
        "disposition": "high-risk",
        "score": 24
      }
    },
    {
      "id": "CPB-010",
      "articleSetCorrect": true,
      "dispositionCorrect": true,
      "scoreError": 28,
      "exactReplay": false,
      "expected": {
        "articles": [
          "03"
        ],
        "disposition": "high-risk",
        "score": 52
      },
      "predicted": {
        "articles": [
          "03"
        ],
        "disposition": "high-risk",
        "score": 24
      }
    },
    {
      "id": "CPB-011",
      "articleSetCorrect": true,
      "dispositionCorrect": true,
      "scoreError": 0,
      "exactReplay": true,
      "expected": {
        "articles": [
          "03"
        ],
        "disposition": "no-explicit-conflict",
        "score": 100
      },
      "predicted": {
        "articles": [
          "03"
        ],
        "disposition": "no-explicit-conflict",
        "score": 100
      }
    },